theme,title,text
world,"переиздание ""майн кампф"" гитлера поступило в продажу в германии","переизданная книга адольфа гитлера ""майн кампф"" (mein kampf) с критическими комментариями, подготовленная институтом современной истории (ifz) в мюнхене, поступила в пятницу в продажу в германии. права на публикацию книги, которые принадлежали правительству баварии, истекли 31 декабря 2015 года. как рассказывал риа новости руководитель проекта, научный сотрудник института кристиан хартманн, цель издания состояла в том, чтобы открыть ""майн кампф"" как важнейший исторический и источник, а также в том, чтобы опровергнуть идеи и утверждения автора результатами современных исследований. институт современной истории имеет многолетний опыт публикаций исторических свидетельств, в том числе и гитлера. например, ранее были выпущены речи, записки и приказы гитлера в 12 томах с февраля 1925 по январь 1933 года, то есть за период от воссоздания нсдап до назначения гитлера рейхсканцлером. mein kampf (""моя борьба"") была написана в 1924 году, гитлер писал ее в заключении. сочинение считается идеологическим фундаментом национал-социализма и при жизни фюрера было опубликовано миллионными тиражами. до 1945 года mein kampf была переведена на 18 языков, было продано более 12 миллионов экземпляров книги. в апреле 2010 года mein kampf гитлера была внесена в российский федеральный список экстремистских материалов."
world,украинцы жалуются обсе на обыски домов добровольческими батальонами,"жители села лопаскино (24 км к северо-западу от луганска), находящегося под контролем украинских силовиков, пожаловались наблюдателям специальной мониторинговой миссии обсе, проводившим патрулирование в данном районе, на то, что в их домах провели обыски члены добровольческого батальона ""луганск 1"", говорится в сообщении пресс-службы смм. батальон ""луганск-1"" — добровольческий батальон патрульной службы полиции особого назначения, созданный в июне 2014 года в структуре мвд украины в днепропетровской области. власти украины в апреле прошлого года начали военную операцию против самопровозглашенных лнр и днр. по последним данным оон, жертвами конфликта стали более 9 тысяч человек. вопрос урегулирования ситуации в донбассе обсуждается в том числе в ходе встреч в минске контактной группы, которая с сентября прошлого года приняла уже три документа, регламентирующих шаги по деэскалации конфликта. на встрече контактной группы в минске 22 декабря стороны конфликта в донбассе договорились о безусловном режиме тишины в регионе с полуночи 23 декабря и о прекращении любых маневров вооруженных формирований в период новогодних и рождественских праздников."
world,король испании в середине февраля совершит визит в саудовскую аравию,"король испании фелипе vi и его супруга летисия отправятся с трехдневным визитом в саудовскую аравию 16 февраля. по словам посла саудовской аравии в мадриде мансура бин халид альфархан аль-сауда, этот визит должен способствовать ""поддержанию и укреплению прекрасных и теплых отношений между двумя странами"". по ее мнению, ""неразумно"", что ""такой институт как монархия, который в принципе должен быть нейтральным и продвигать ценности испанского общества"" совершает официальных визит в страну, где ""женщины подвергаются систематической ежедневной дискриминации (им даже запрещено садиться за руль), защитники прав человека подвергаются постоянным репрессиям"", где происходят события, которые ""могут стать причиной озабоченности и осуждения"". партия в своем обращении также напомнила о казни 2 января 47 человек, в том числе шиитского проповедника ан-нимра. кроме того, podemos потребовала прекратить поставки вооружения эр-рияду. с 2003 по 2014 годы испания поставила различного вооружения в саудовскую аравию на сумму в 725 миллионов евро. королевская семья испании традиционно поддерживает хорошие отношения с саудовским руководством. несколько недель назад отец нынешнего главы государства, король хуан карлос ездил с частным визитом в эр-рияд. это не первый визит фелипе vi в саудовскую арвию. он посещал похороны наследного принца саудовской аравии султана бен абдель азиза аль-сауда в 2011 году, а также был в этой стране в начале 2015 года на похоронах короля абдаллы бен абдель азиза аль-сауда."
world,япония и южная корея будут обмениваться данными об испытаниях в кндр,"министры обороны японии и южной кореи гэн накатани и хан мин гу договорились усилить взаимодействие и обмениваться информацией между токио, сеулом и вашингтоном по разработке ответных мер в отношении кндр после проведения пхеньяном последнего ядерного испытания. ""министры обороны хан мин гу и гэн накатани в телефонном разговоре договорились обмениваться информацией между японией, южной кореей и сша и работать в тесном взаимодействии относительно ситуации вокруг кндр"", — говорится в пресс-релизе южнокорейского оборонного ведомства. министр обороны японии отметил, что ""ядерное испытание кндр является нарушением резолюций совета безопасности оон"", и заявил о неприятии подобных действий. в свою очередь, хан мин гу подчеркнул, что ""ядерное испытание кндр является угрозой безопасности и миру во всем мире и, безусловно, на корейском полуострове"", поэтому для урегулирования ситуации ""важны единые усилия международного сообщества"". кндр заявила 6 января, что провела первое испытание водородной бомбы. международное сообщество, в том числе ключевые ядерные державы, осудили действия пхеньяна, выразив обеспокоенность и опасения относительно осложнения ситуации в регионе."
world,"шестьдесят боевиков ""талибана"" ликвидированы за сутки в афганистане","не менее 60 боевиков радикального движения ""талибан"" были ликвидированы за сутки в ходе спецопераций в разных районах афганистана, сообщает в пятницу агентство пажвак со ссылкой на заявление министерства обороны страны. рейды проводились в 13 афганских провинциях. также сообщается, что четыре боевика были задержаны, 14 получили ранения. помимо этого, службы безопасности и вооруженные силы страны конфисковали у боевиков оружие и боеприпасы, сообщил агентству представитель минобороны афганистана давлат вазири (dawlat waziri). ситуация в афганистане в последние месяцы заметно ухудшилась. радикальное движение ""талибан"", ранее овладевшее значительной территорией в сельских районах страны, развернуло наступление на крупные города. в конце сентября боевики ""талибана"" захватили североафганский город кундуз, насчитывавший в мирное время более 300 тысяч жителей, а ныне ведут атаки на город газни, административный центр одноименной провинции к юго-западу от столицы страны кабула."
world,днр против идеи киева направить в донбасс постпредов стран сб оон,"в днр выступили против предложения киева направить в донбасс представителей стран-членов совета безопасности оон, чтобы обсудить развертывание миротворческой операции в регионе, заявил в пятницу полпред самопровозглашенной донецкой народной республики на минских переговорах денис пушилин. ""я хотел бы напомнить, что существует комплекс мер по реализации минских соглашений, подписанный 12 февраля 2015 года. и согласно п.3 этого документа, контроль и верификация возложены на специальную мониторинговую миссию обсе. никаких представителей оон и других миротворческих организаций не предусмотрено"", — приводит его слова донецкое агентство новостей. новый представитель украины при оон владимир ельченко заявил, что киев планирует организовать поездку в донбасс постоянных представителей стран-членов совета безопасности организации объединенных наций. ранее ельченко заявлял, что украина приглашает к себе оценочную миссию оон для подготовки миротворческой операции в донбассе. украинские власти в марте выступили с инициативой развернуть в донбассе миротворческую миссию. военная миротворческая миссия может быть сформирована только с санкции совбеза оон. россия, обладающая правом вето в сб, готова обсуждать вопрос отправки миротворцев на украину, но у руководства страны есть ряд вопросов. украина с 1 января 2016 года стала непостоянным членом совета безопасности оон на следующие два года. решение об этом было принято на заседании генеральной ассамблеи оон 15 октября 2015 года."
world,сми: иран не подтверждает вызов посла в мид турции,"визит посла ирана в анкаре в мид турции был связан с обсуждением последних тенденций развития в регионе, сообщает агентство mehr со ссылкой на информированный источник в мид ирана. ранее сми передавали, что мид турции вызвал посла ирана в анкаре и выразил недовольство в связи с публикациями в прессе сообщений, связывающих визит турецкого президента тайипа эрдогана в саудовскую аравию с казнями в королевстве. по информации иранского агентства irna, посол ирана в анкаре провел встречи с рядом представителей мид турции, обсудив с ними предстоящие визиты турецких чиновников в иран и другие вопросы сотрудничества двух государств. эрдоган посетил саудовскую аравию в конце декабря. уже 2 января мвд саудовской аравии объявило о казни 47 человек, в том числе шиитского проповедника нимра ан-нимра. тегеран резко осудил казнь проповедника, в иране прошли массовые акции протеста, в частности были атакованы саудовские посольство в тегеране и консульство в мешхеде. глава саудовского мид адиль аль-джубейр заявил о разрыве дипломатических отношений с ираном. сам президент турции заявил, что считает казни, проведенные саудовской аравией, внутриполитическим делом страны."
world,"более 3,3 тысячи пунктов обогрева развернуты на украине из-за непогоды","более 3,3 тысячи пунктов обогрева развернуты на украине в связи с непогодой, в них уже оказана помощь более 32 тысячам граждан, сообщил глава госслужбы украины по чрезвычайным ситуациям (гсчс) николай чечоткин. ""с целью предотвращения случаев переохлаждения и обмораживания людей в период понижения температуры воздуха во время неблагоприятных погодных условий в государстве на сегодняшний день функционирует более 3 тысяч 300 пунктов обогрева, в которых предоставлена помощь более 32 тысячам граждан, в том числе это 3 145 стационарных пунктов обогрева, которые развернуты органами местной власти, и 191 мобильный пункт обогрева, развернутые силами гсчс"", — сказал чечоткин в пятницу на заседании межведомственного оперативного штаба госкомиссии по вопросам техногенно-экологической безопасности и чрезвычайных ситуаций. в начале января на украину пришло значительное похолодание."
world,"сми: эрдоган не сможет выбраться из ""порочного круга"" своей политики","президент турции реджеп тайип эрдоган безо всякой необходимости прервал мирное урегулирование с курдами, создал дополнительный очаг конфликта на ближнем востоке и должен теперь ответить за это, пишет frankfurter rundschau. сегодняшняя ситуация в турции напоминает о страшном времени начала 1990-х годов, когда война с курдами была в самом разгаре. турецкая армия демонстрирует несоразмерную жестокость на юго-востоке страны, солдаты не успевают перетаскивать тела убитых. с другой стороны — рабочая партия курдистана (рпк), которая берет заложников, строит баррикады и убивает тех, кто не желает принимать их сторону, пишет издание. это порочный круг, который очень сложно нарушить, и ответственность за происходящее лежит на эрдогане, который возобновил ""гражданскую войну"" накануне выборов, чтобы привлечь на свою сторону националистически настроенных избирателей, подчеркивает издание. европа должна быть особенно заинтересована в прекращении кровопролития и ей следовало бы оказать давление на эрдогана, пишет frankfurter rundschau. однако в последнее время лидеры ес боятся критиковать анкару, поскольку турция является единственным ""пограничным пунктом"" между ними и беженцами."
world,автомобиль со снарядами задержан в центре латвийской кулдиги,"автомобиль со снарядами задержан в пятницу в центре латвийского города кулдига, сообщает госполиция. ""сотрудники полиции в центре кулдиги, на перекрестке улиц лиепаяс и райня, остановили машину, в салоне которой находились предметы, вызвавшие подозрение у правоохранительных органов. скорее всего, речь идет о снарядах времен второй мировой войны. на место были вызваны саперы, которые забрали из автомобиля все опасные боеприпасы"", — сообщили в полиции. по данному факту были задержаны два человека, возбуждено уголовное дело."
world,мид фрг получил запрос от польши о пострадавших гражданах в кельне,"мид фрг получил запрос от польского внешнеполитического ведомства о том, не пострадали ли граждане и гражданки польши в ходе беспорядков в кельне, заявил на брифинге в пятницу официальный представитель мид мартин шефер. ""мы подтверждаем, что подобное письмо было получено от польских коллег"", — сказал шефер. во вторник полиция кельна сообщила, что получила около 90 заявлений от женщин, которые подверглись в новогоднюю ночь сексуальным домогательствам со стороны мужчин ""африканской и арабской внешности"", предположительно, мигрантов. как сообщила газета spiegel со ссылкой на начальника полиции вольфганга альберса, в общей сложности на площади перед кельнским собором собрались около тысячи мужчин в возрасте от 15 до 35 лет. согласно свидетельским показаниям, подвыпившие мужчины толпой окружали женщин, вырывали кошельки и мобильные телефоны, а тем, кто пытался вмешаться, угрожали расправой."
