theme,title,text
world,фалин: раскол европы нужно было предотвращать 25 лет назад,"раскол европы необходимо было предотвращать еще четверть века назад, сразу после падения берлинской стены, однако, теперь время упущено, мир стал совершенно другим, поделился своим мнением с риа новости один из участников переговоров об объединении германии, заведующий международным отделом цк кпсс (1989—1991 гг), доктор исторических наук валентин фалин. путин в интервью немецкому изданию bild заявил, что ""мы всё сделали неправильно, с первых шагов, мы не преодолели раскола европы"". российский президент подчеркнул, что ""25 лет назад берлинская стена пала, но раскол европы не был преодолён, невидимые стены просто были передвинуты на восток, что ""создало предпосылки для будущих взаимных упрёков, непонимания и кризисов"". фалин отметил, что в то время ""имелись разные модели объединения германия и тем самым ликвидации раскола европы и мира на два лагеря"". по его словам, советская интерпретация, ""очень близкие мысли"" на счет которой высказывали эгон бар (депутат бундестага, ""архитектор"" внешней политики фрг), ханс-йохен фогель (председатель социал-демократической партии германии) и вилли брандт (экс-председатель сдпг, почетный председатель партии), состояла в следующем: ""нам нужно заменить противостояние двух сил, военных группировок – нато и варшавского договора – общеевропейской системой безопасности"". ""мы выступали за идею общеевропейского дома, в котором все нации, все государства имели бы равные права, где строго соблюдался бы принцип неделимости безопасности и равенства"", — объяснил фалин. дипломат поделился содержанием своего телефонного разговора с михаилом горбачевым перед его переговорами по объединению германии с канцлером фрг гельмутом колем на правительственной даче в архызе. ""кончил тогда разговор горбачев словами: ""я сделаю все, что смогу, но боюсь, поезд уже ушел"". он ушел настолько, что немцы, выйдя из зала переговоров, говорили: ""не может быть, не может быть. мы получили все, что даже не ожидали"", — рассказал он. ""чем руководствовался горбачев, почему он сдал все позиции, почему он принял модель, которая не укладывалась ни в какие ожидания даже самих западных немцев…"", — недоумевал фалин. по его мнению, ""время ушло настолько далеко, время потеряно, не только время, но и философия этого времени утрачена настолько глубоко – не знаешь, что нужно, какое событие должно произойти"". ""мы живем в совершенно другом мире, когда потенциал уничтожения всего человечества зависит даже не от воли правительства. он может от воли какого-то герострата зависеть"", — считает фалин."
world,сестра савченко пришла на рассмотрение дела ерофеева и александрова,"сестра обвиняемой в причастности к гибели в донбассе российских журналистов украинки надежды савченко, суд над которой сейчас проходит в россии, пришла на заседание киевского райсуда, рассматривающего дело россиян евгения ерофеева и александра александрова. в перерыве судебного заседания вера подошла к россиянам и сказала им о том, что ее сестра надежда савченко спрашивала о них. ""надеюсь, что вы и она будете обменены. свободы вам!"" — добавила вера. журналисты спросили у россиян, желают ли они свободы савченко. однако ерофеев и александров промолчали в ответ на этот вопрос. после этого журналистов вывели из зала суда, поскольку в судебном заседании был объявлен перерыв.  до перерыва суд успел допросить одного свидетеля со стороны обвинения — врача, который оказывал медицинскую помощь россиянам после их задержания. он рассказал, что александров и ерофеев в ходе беседы с ним сказали, что якобы они являются работниками спецназа российской федерации. каких-либо существенных фактов свидетель суду не сообщил. в свою очередь, сторона обвинения отметила, что у них еще около 20 свидетелей. согласно процедуре, суд сможет перейти к допросу свидетелей защиты после допроса всех свидетелей обвинения."
world,"сми: один из лидеров ""талибана"" убит на западе афганистана","высокопоставленный командир радикального движения ""талибан"" и десять боевиков убиты в ходе перестрелки с силами национальной безопасности афганистана в провинции фарах на западе страны, сообщает агентство khaama press со ссылкой на местные власти. как заявил представитель полиции провинции торялаи абадяни (toryalai abadyani), один из лидеров ""талибана"", опознанный как мулла бисмилла (mullah bismillah), и десять боевиков были убиты в ходе перестрелки, продолжавшейся более часа. по данным властей, перестрелка началась после того, как боевики устроили засаду сотрудникам служб безопасности в районе пошт кох (posht koh).  ситуация в афганистане в последние месяцы заметно ухудшилась. радикальное движение ""талибан"", ранее овладевшее значительной территорией в сельских районах страны, развернуло наступление на крупные города. также на территории страны выросло влияние радикальной группировки ""исламское государство"" (иг, запрещена в рф). ""талибан"" и иг считаются конкурирующими группировками. в середине июня сми сообщали о том, что представители движения ""талибан"" послали письмо ""исламскому государству"" с призывом не вмешиваться в дела талибов в афганистане. на территории афганистана между группировками ранее происходили столкновения."
world,смр выразил соболезнования семьям погибших в стамбульском теракте,"совет муфтиев россии (смр) выступил заявлением, в котором осудил действия террористов, устроивших взрыв в стамбуле, выразил соболезнования семьям погибших и пожелал скорейшего выздоровления пострадавшим, сообщает во вторник официальный сайт организации. ""совет муфтиев россии и мусульмане страны гневно осуждают действия преступников, которые совершают величайших грех — убивают невинных людей"", говорится в сообщении. в организации заявили, что молятся о даровании ""терпения и мужества всем семьям погибших и скорейшего выздоровления, здоровья пострадавшим в результате взрыва"", и отмечают, что ""коран предписывает верующим отвечать добром даже тем, кто причиняет ему зло и боль"". мощный взрыв прогремел во вторник утром в районе площади султанахмет рядом с трамвайной остановкой в момент, когда там находилась группа туристов. по данным властей, по меньшей мере десять человек погибли, 15 ранены, большинство жертв — иностранцы. президент турции тайип эрдоган заявил, что взрыв совершил террорист-смертник из сирии."
world,омбудсмен: 13 детей в днр полностью осиротели в результате конфликта,"тринадцать детей в самопровозглашенной донецкой народной республике с начала конфликта в донбассе остались круглыми сиротами в результате боевых действий, сообщила в понедельник риа новости детский омбудсмен днр яна чепикова. ""в днр 13 детей остались круглыми сиротами. это дети, которые лишились и мамы, и папы в результате боевых действий. трое из них – это совсем маленькие дети в возрасте до шести лет"", — сказала она. власти украины в апреле 2014 года начали военную операцию против самопровозглашенных лнр и днр. по последним данным оон, жертвами конфликта стали более 9 тысяч человек. вопрос урегулирования ситуации в донбассе обсуждается, в том числе в ходе встреч в минске контактной группы, которая с сентября 2014 года приняла уже три документа, регламентирующих шаги по деэскалации конфликта. "
world,сербская церковь протестует против  осквернения  храма в приштине,"албанские радикалы вновь осквернили возводимый православный храм христа спасителя в центре приштины, сообщает в понедельник сайт сербской православной церкви (спц). с резким осуждением акта вандализма выступил епископ рашко-призренский и косово-метохийский феодосий, призвавший вмешаться в происходящее представителей косовских властей. как уточняется в сообщении, хулиганы выломали металлические ворота и справили нужду в помещении храма. соответствующее видео опубликовано на официальной интернет-странице спц. ""это акт вандализма, крайнего примитивизма и бескультурья, который заслуживает особенного осуждения из-за того, что на видео заметны сотрудники косовской полиции, которые мирно прохаживаются рядом с выломанными воротами храма, который демонстранты в ходе протестов (9 января – ред.) использовали как общественный туалет"", — говорится в сообщении спц. в сербской церкви с сожалением констатировали, что происшедшее является очередным инцидентом на фоне ""многочисленных нападений и осквернений этого храма в центре города"". активисты косовской оппозиции в минувшую субботу устроили беспорядки в приштине, протестуя, в частности, против соглашения с сербией о создании в крае сообщества сербских общин (ссо). президент сербии томислав николич в ходе выступления на генассамблее оон в сентябре прошлого года заявил о том, что албанские власти косово хотят получить контроль над православными храмами через юнеско, провозгласив сербское наследие в косово албанским и косоварским. по словам николича, это недопустимо для сербии и может стать опасным международным прецедентом. по данным сербских властей, албанские террористы с июня 1999 года уничтожили 140 православных святынь в косово. власти косово провозгласили в одностороннем порядке независимость от сербии в 2008 году."
world,сми: вс бельгии за год распродали армейского имущества на 5 млн евро,"вооруженные силы бельгии пополнили бюджет, распродав в 2015 году устаревшей военной техники и армейского имущества на общую сумму около 5 миллионов евро, что на 400 тысяч евро больше, чем годом ранее, сообщила в понедельник газета derniere heure. на публичных торгах и открытых распродажах по формуле ""плати и бери"" были реализованы, главным образом, армейские автомобили, различное офисное имущество, включая компьютеры и мобильные телефоны, а также отдельные предметы воинского обмундирования, спальные мешки и палатки. все вырученные от продаж деньги пойдут в бюджет бельгийской армии. со списком распродаваемой армейской техники и имущества можно было ознакомиться на интернет-сайте минобороны королевства. отмечается, что распродажа устаревшей или списанной боевой техники и вооружений на публичных торгах в бельгии запрещена. сми ранее сообщали, что численность бельгийской армии может сократиться в среднесрочной перспективе с нынешних 32 тысяч до 20 тысяч человек — в результате сокращения расходов на оборону. их планировалось урезать с 0,66% национального ввп в 2013 году до 0,5% в 2019 году, несмотря на то, что нато требует от своих членов повысить расходы на эту статью до 2% ввп. власти бельгии в результате рассчитывали сэкономить 1,55 миллиарда евро, из них 200 миллионов евро — в 2015 году."
world,мккк продолжит составление списков пропавших без вести в донбассе,"международный комитет красного креста продолжает работу над списками без вести пропавших в донбассе; по информации мккк, таких более тысячи человек, рассказал риа новости представитель организации. ранее гуманитарная подгруппа контактной группы по урегулированию ситуации в донбассе договорилась о передаче списков всех пропавших без вести в мккк. ранее уполномоченный по правам человека в днр дарья морозова заявила, что лишь в самопровозглашенной днр пропавшими без вести числятся более двух тысяч человек. киев заявил, что передал мккк списки 762 пропавших без вести в донбассе. власти украины в апреле 2014 года начали военную операцию против самопровозглашенных лнр и днр. по последним данным оон, жертвами конфликта стали более 9 тысяч человек."
world,косачев: польша перестала вписываться в европейские тренды,"европейские структуры беспокоит, что польша перестала вписываться в евротренды. и если венгрия была ""первопроходцем"" при выстраивании собственной внутренней политики, то в случае с польшей можно говорить уже о тенденции в ес, считает глава международного комитета совфеда константин косачев. ""на рубеже двух годов много хлопот евросоюзу доставила польша, 24 декабря верхняя палата сейма утвердила весьма радикальные поправки в порядок функционирования конституционного суда, которые председатель европарламента мартин шульц охарактеризовал как ""переворот"", — заявил косачев риа новости в понедельник. в брюсселе реагировали жестко: еврокомиссар гюнтер эттингер заявил, что польшу следует поставить под наблюдение еврокомиссии. но поляки ответили еще жестче – что называется, ""на грани фола"". министр юстиции польши сбигнев зебро заявил, что слова эттингера о ""надзоре"" за польшей ""вызывают у поляков самые худшие ассоциации"". он также обвинил евросоюз в использовании методов ""времен второй мировой войны"". ""безусловно, евроорганы беспокоят не столько ожидавшиеся радикальные изменения в польской внутренней политике, а насколько это вписывается в европейские тренды"", — сказал косачев. вначале была венгрия – в июне европарламент принял резолюцию с осуждением ""тревожных событий"" в венгрии и ослабления демократических норм. в декабре в другой резолюции еврокомиссию призвали подвергнуть венгрию процедуре мониторинга практики ее госуправления. ""но если венгрия казалась особым случаем, то польша – это уже явная тенденция"", — полагает он. польский вопрос сенатор также отметил, что парадоксально, но на выборах в октябре проиграла ""партия успеха"". это было правительство с лучшими за последнее время показателями в европе (и даже во всей организации экономического сотрудничества и развития — оэср): оно создавало рабочие места, повышало доходы, ежегодный прирост ввп в среднем составлял 3,2% — выше, чем у лидеров. и, тем не менее, избиратели посчитали экономическую ситуацию и ""направление, в котором страна движется"", по опросам, ""плохим"" или ""очень плохим""."
