theme,title,text
world,"""хезболлах"" взяло ответственность за атаку на израильский патруль","шиитское движение ""хезболлах"" взяло ответственность за атаку на израильский военный патруль вблизи ливано-израильской границы. ""группировка ""мученик кунтар"" (активист, ответственность за гибель которого движение возлагает на израиль — ред.) подорвала взрывное устройство на дороге в оккупированном израилем ливанском районе шеба, в результате чего взорвался автомобиль марки hummer, и пострадали находившиеся в нем"", — приводит телеканал ""аль-манар"" заявление ""хезболлах"". как сообщила ранее риа новости сотрудница израильской армейской пресс-службы, на пути следования военного автомобиля на границе с ливаном сработало взрывное устройство, на что армия израиля ответила огнем артиллерии по территории соседнего государства. данных о пострадавших среди израильских военных сотрудница пресс-службы предоставить не смогла. ливанский источник в свою очередь сообщил агентству sputnik, что порядка 50 снарядов упали на территории военной базы и населенных пунктов в южных районах ливана, есть данные о раненых среди мирных жителей. обмен артиллерийским огнем стал фиксироваться на ливано-израильской границе после гибели в результате авиаудара близ дамаска известного активиста ливанского движения ""хезболлах"" самира кунтара. ответственность за его ликвидацию ""хезболлах"" возложила на израиль, где в свою очередь не стали комментировать возможную причастность к авианалету."
world,"земан считает, что миграцию в европу организуют ""братья-мусульмане""","организатором массовой миграции в европу является ассоциация ""братья-мусульмане"", заявил в понедельник президент чехии милош земан, выступая по чешскому радио плюс.  ""по данным интерпола, в организации вторжения участвует около 30 тысяч контрабандистов, — заявил чешский президент. — согласно иным данным, только в турции 25 тысяч контрабандистов. это больше, чем имеет (военнослужащих) целая чешская армия"", — подчеркнул земан. кроме того, земан назвал одним из факторов, способствовавших массовому характеру миграции на старый континент, приглашения в адрес беженцев со стороны некоторых европейских политиков. ассоциация ""братья-мусульмане"" — международная религиозно-политическая ассоциация, основанная в марте 1928 года в египте и имеющая множество сторонников в ряде арабских стран. верховный суд рф признал организацию террористической и запретил её деятельность на территории российской федерации. кроме того, ее деятельность запрещена в сирии, египте, саудовской аравии, бахрейне и оаэ."
world,саудовская аравия намерена полностью прекратить авиасообщение с ираном,"глава мид саудовской аравии адиль аль-джубейр сообщил о намерении королевства полностью прекратить авиасообщение с ираном, сообщает агентство рейтер. кроме того, страна намерена оборвать все коммерческие связи с тегераном и ввести запрет на посещение ирана всеми своими подданными. при этом министр отметил, что иранские паломники смогут посещать королевство. в воскресенье глава мид саудовской аравии адиль аль-джубейр заявил о разрыве дипотношений с ираном из-за его ""откровенного вмешательства во внутренние дела королевства, вражеских действий в регионе и нападения на посольство королевства в тегеране и консульство в городе мешхед"". инциденты произошли в субботу в рамках акций протеста против решения саудовской аравии казнить известного шиитского проповедника нимра ан-нимра. в субботу мвд саудовской аравии объявило о казни 47 человек, осужденных за терроризм и подстрекательство к нему. среди казненных был шиитский проповедник нимр ан-нимр. сообщение о его казни вызвало негодование со стороны шиитских политических и религиозных деятелей исламского мира. генсек оон пан ги мун выразил обеспокоенность произошедшим."
world,сми: второй за день взрыв прогремел возле аэропорта в кабуле,"второй за день мощный взрыв прогремел в понедельник возле международного аэропорта кабула, есть пострадавшие, передает телеканал tolo news. по данным телеканала, заминированный автомобиль взорвался у восточных ворот аэропорта. ранее у одного из кпп аэропорта прогремел взрыв, также устроенный террористом-смертником на заминированном автомобиле."
world,ближневосточный разрыв: ряд стран прекратил дипотношения с ираном,"главы мид сразу нескольких государств вслед за саудовской аравией объявили о разрыве или понижении статуса дипломатических отношений с ираном. конфликт между эр-риядом и тегераном получил развитие после того, как 2 января стало известно о казни 47 человек в саудовской аравии, которые были признаны виновными в терроризме или подстрекательстве к нему. среди казненных значился шиитский проповедник нимр ан-нимр. сразу после этого сообщения со стороны официальных представителей тегерана последовал ряд жестких комментариев, осуждающих действия саудовских властей.  вечером того же дня глава мид саудовской аравии адиль аль-джубейр заявил о разрыве дипотношений с ираном из-за его ""откровенного вмешательства во внутренние дела королевства, вражеских действий в регионе и нападений на посольство королевства в тегеране и консульство в городе мешхед"". в знак солидарности с эр-риядом о разрыве дипломатических отношений 4 января заявил бахрейн, который изначально призывал внешних наблюдателей не вмешиваться во внутренние дела саудовского королевства. ""королевство бахрейн приняло решение разорвать дипломатические отношения с исламской республикой иран и требует от всех сотрудников дипмиссии покинуть королевство в течение 48 часов. королевство также закрывает свою дипмиссию в иране и отзывает всех ее сотрудников"", — сообщило национальное агентство bna. стоит отметить, что население бахрейна также выражало протест против казни ан-нимра. кроме того, о прекращении дипотношений с тегераном заявил судан. ""на фоне грубого нападения на посольство саудовской аравии в тегеране и консульство в мешхеде… правительство судана солидарно с братским королевством саудовская аравия… и объявляет о немедленном разрыве дипломатических отношений с исламской республикой иран"", — говорится в коммюнике мид страны. "
world,сми: китаянка попыталась выпрыгнуть из летящего самолета,"пассажирка самолета пекинской авиакомпании capital airlines, летевшего из города чанша в пункт санья, во время перелета попыталась открыть аварийную дверь и выйти из самолета, сообщает south china morning post. по информации китайских сми, женщина на борту самолета решила покончить жизнь самоубийством, покинув самолет во время полета. когда члены экипажа попытались остановить ее, за нее вступились два других пассажира, завязалась потасовка. однако, несмотря на инцидент, самолет успешно приземлился в пункте назначения, сообщает издание. в настоящее время виновники инцидента находятся под стражей на основании угрозы общественной безопасности, обстоятельства дела выясняются."
world,армия израиля открыла огонь по ливану в ответ на нападение на патруль,"взрывное устройство сработало рядом с израильскими военными машинами на границе с ливаном, армия ответила огнем артиллерии по территории соседнего государства, сообщила риа новости сотрудница армейской пресс-службы. она уточнила, что обстрелу подверглись объекты движения ливанских шиитов ""хезболлах"", которое взяло на себя ответственность за нападение на израильских военных. ""самодельное взрывное устройство было использовано против военных автомобилей в районе горы хар-дов. наши силы ответили прицельным артиллерийским огнем"", — сказала собеседница агентства.  она добавила, что в пресс-службу не поступало информации о наличии пострадавших среди военных. по данным местного радио, фугас большой мощности сработал рядом с двумя бронированными бульдозерами d9, которые армия использует для инженерной разведки."
world,минск может быть площадкой для встречи глав армении и азербайджана,"минск может быть площадкой для встречи президентов армении и азербайджана, заявил в понедельник посол белоруссии в ереване игорь назарук в интервью новостному сайту news.am. по его словам, для того, чтобы решать такие вопросы, как карабахский, не в ""горячем"", а в ""холодном"" режиме, нужны переговоры. ""на это, собственно, и нацелена минская группа обсе. уверен — когда начинаются контакты, появляется большая степень понимания друг друга, а когда мы больше друг друга понимаем, значит, появляются дополнительные элементы доверия. я убежден, что это единственно правильный путь. переговоры, спокойное общение, без каких-либо переходов к ""горячей» фазе"", — сказал назарук. президенты азербайджана и армении ильхам алиев и серж саргсян 19 декабря провели первые переговоры за год в берне. встреча лидеров двух стран прошла в рамках переговорного процесса по урегулированию нагорно-карабахской проблемы, при посредничестве сопредседателей минской группы обсе игоря попова (россия), джеймса уорлика (сша), пьера андрие (франция) и личного представителя действующего председателя обсе анджея каспршика. уорлик написал в twitter, что саргсян и алиев договорились продолжить переговоры в 2016 году. конфликт между арменией и азербайджаном из-за нагорного карабаха начался в феврале 1988 года, когда нагорно-карабахская автономная область заявила о выходе из азербайджанской сср. в сентябре 1991 года в центре нкао степанакерте было объявлено о создании нагорно-карабахской республики. азербайджан в ходе последующего военного конфликта потерял контроль над нагорным карабахом. с 1992 года ведутся переговоры по мирному урегулированию конфликта в рамках минской группы обсе. азербайджан настаивает на сохранении своей территориальной целостности, армения защищает интересы непризнанной республики, так как нкр не является стороной переговоров."
world,сми: израильская артиллерия подвергла обстрелу районы на юге ливана,"израильская артиллерия подвергла обстрелу районы на юге ливана, выпустив порядка 50 снарядов, которые в том числе упали на территории базы армии, сообщил полевой источник агентству sputnik. как сообщил источник, обстрелу подвергся ряд населенных пунктов, включая города эль-ваззани и эль-мари, а также база армии близ района шеба на границе с израилем. по данным источника, есть раненые среди мирных жителей. как сообщила риа новости сотрудница пресс-службы израильской армии, артиллерия открыла огонь по ливану в ответ на нападение на патруль. согласно заявлению израильских военных, на пути следования военного автомобиля на границе с ливаном сработало взрывное устройство."
world,кэмерон: террористам иг не удастся запугать британию,"премьер-министр великобритании дэвид кэмерон после публикации видео, на котором якобы заснята казнь пятерых британцев, заявил, что террористическая группировка ""исламское государство"" (иг, запрещена в рф) не запугает великобританию.  ""они ненавидят нас не за то, что мы делаем, а за то, кто мы есть. за тот факт, что мы успешная, толерантная, демократичная, мультирелигиозная и мультикультурная нация"", — сказал он. ""британия никогда не будет запугана подобного рода терроризмом"", — подчеркнул кэмерон. ""возможно, это потребует долгого времени, но они (террористы) будут уничтожены"", — добавил он. операцию против иг в сирии великобритания начала в ночь на 3 декабря прошлого года сразу после того, как парламент страны одобрил участие страны в ней. операцию против иг в ираке британия проводит с 2014 года в рамках международной коалиции."
world,два человека погибли в ходе нападения иг на нефтяной порт в ливии,"два человека стали жертвами нападения боевиков террористической группировки ""исламское государство"" (иг, запрещена в рф) на один из крупнейших в ливии экспортных терминалов эс-сидр, передает агентство рейтер. как сообщил один из охранников терминала, боевики подожгли нефтяной резервуар. по его данным, террористы отступили в соседние районы. работа двух крупнейших экспортных терминалов эс-сидр и рас-лануф, которые отвечают за половину объема добычи нефти в ливии, была остановлена в декабре 2014 года. после падения режима муаммара каддафи в стране возникло двоевластие: с одной стороны — избранный на всеобщих выборах парламент, заседающий в тобруке на востоке страны, с другой — происламский всеобщий национальный конгресс в триполи. из-за боевых действий несколько нефтяных портов были повреждены или взяты под контроль месторождения боевиками группировки ""исламское государство"" (иг). "
world,зайберт: еврокомиссия должна обсуждать сложившуюся ситуацию в польше,"вопрос о возможных нарушениях польшей европейского права должен решаться на уровне еврокомиссии, заявил в понедельник на брифинге официальный представитель правительства фрг штеффен зайберт.  в понедельник, 28 декабря, президент польши анджей дуда утвердил принятые правым большинством в парламенте поправки к скандальному закону о конституционном суде, вызвавшие ожесточенные споры в стране. конституционный суд больше не сможет прекращать полномочия судей и вправе будет лишь подготовить соответствующий запрос в нижнюю палату парламента (сейм) и лишь ""в особо вопиющих случаях"", а дисциплинарные взыскания в отношении судей можно будет применять лишь по запросу президента или министра юстиции. кроме того, сам суд расширяется с 9 до 15 судей, а для утверждения решений потребуется согласие двух третей состава, а не обычного большинства, как ранее. "
